{
  "schemaVersion": 1,
  "id": "acc-reconnect-durable-player-state",
  "lane": "acceptance",
  "artifact": {
    "label": "Reconnect reads durable player progression state",
    "file": "engine/fixtures/acceptance/result-transaction/reconnect-durable-player-state.ts",
    "sha256": "d9fa9d8190ff169a2efc013156a137f29b2d79cc87f7fe8ee0e8c6d833cdcf54"
  },
  "target": {
    "edition": "bedrock",
    "minecraftVersion": "1.21.x"
  },
  "expected": {
    "disposition": "designed-behavior",
    "domain": "Persistence Recovery Integrity",
    "proofCeiling": "STATIC VERIFIED"
  },
  "provenance": {
    "frozenBeforeRun": true,
    "source": "engine/contracts/engineering/catalogs/round-integrity-contract.json"
  }
}
