{
  "schemaVersion": 1,
  "id": "reg-progression-deferred-spawn-unreserved",
  "lane": "regression",
  "artifact": {
    "label": "Zero-gated enemy counter with unreserved deferred materialization",
    "file": "engine/fixtures/regressions/progression/deferred-spawn-unreserved.ts",
    "sha256": "17cdce56da1c7de85c6b83d24edfc5a99d3219b58579096f69997187e71ae350"
  },
  "target": {
    "edition": "bedrock",
    "minecraftVersion": "1.21.x"
  },
  "expected": {
    "disposition": "insufficient-evidence",
    "domain": "Progression Actor Population Integrity",
    "proofCeiling": "STATIC VERIFIED"
  },
  "provenance": {
    "frozenBeforeRun": true,
    "source": "engine/contracts/engineering/catalogs/round-integrity-contract.json"
  }
}
