{
  "schemaVersion": 1,
  "lane": "regression",
  "id": "reg-defense-v1-1-1-bug-def-lease-reset",
  "artifact": {
    "label": "Defense Challenge v1.1.1.mcworld",
    "sha256": "edb6fa56834279210f85de15637c4a980b9e6e9eafce93bcde5fd1ade9c729ee",
    "mapVersion": "1.1.1"
  },
  "target": {
    "edition": "education",
    "minecraftVersion": "1.21.130"
  },
  "expected": {
    "disposition": "defect",
    "domain": "multiplayer",
    "proofCeiling": "static-proven",
    "reason": "Arena reset can release a ticking-area lease owned by a newer run."
  },
  "provenance": {
    "frozenBeforeRun": true,
    "source": "Canonical Bug Report V2 workspace/reports/Defense-Challenge-v1.1.1-BugReport.json; approved pre-existing static audit on the exact SHA-256 artifact."
  }
}
