{
  "schemaVersion": 1,
  "id": "acc-result-record-missing-reward-op",
  "lane": "acceptance",
  "artifact": {
    "label": "Durable result record missing reward operation identity",
    "file": "engine/fixtures/acceptance/result-transaction/result-record-missing-reward-op.ts",
    "sha256": "119fb425b285349f42ea6b4728fda8de59890e92966372acdfa2357e46345326"
  },
  "target": {
    "edition": "bedrock",
    "minecraftVersion": "1.21.x"
  },
  "expected": {
    "disposition": "insufficient-evidence",
    "domain": "Persistence Recovery Integrity",
    "proofCeiling": "STATIC VERIFIED"
  },
  "provenance": {
    "frozenBeforeRun": true,
    "source": "engine/contracts/engineering/catalogs/round-integrity-contract.json"
  }
}
