{
  "schemaVersion": 1,
  "id": "acc-reconnect-session-state",
  "lane": "acceptance",
  "artifact": {
    "label": "Reconnect reads persisted session-scoped state without reconciliation proof",
    "file": "engine/fixtures/acceptance/result-transaction/reconnect-session-state.ts",
    "sha256": "41dac25466eccda4d67f97712d592d430828d54e6e10ead6275c4db2546daf57"
  },
  "target": {
    "edition": "bedrock",
    "minecraftVersion": "1.21.x"
  },
  "expected": {
    "disposition": "insufficient-evidence",
    "domain": "Persistence Recovery Integrity",
    "proofCeiling": "STATIC VERIFIED"
  },
  "provenance": {
    "frozenBeforeRun": true,
    "source": "engine/contracts/engineering/catalogs/round-integrity-contract.json"
  }
}
