{
  "schemaVersion": 1,
  "id": "reg-result-transaction-reward-journal-before-cleanup",
  "lane": "regression",
  "artifact": {
    "label": "Reward operation journal committed before destructive cleanup",
    "file": "engine/fixtures/regressions/result-transaction/reward-journal-before-cleanup.ts",
    "sha256": "87c4038228663c06389001246378ea4b3a140ac199eb27040bc63c5d64f1ac6f"
  },
  "target": {
    "edition": "bedrock",
    "minecraftVersion": "1.21.x"
  },
  "expected": {
    "disposition": "designed-behavior",
    "domain": "Round Result Transaction Integrity",
    "proofCeiling": "STATIC VERIFIED"
  },
  "provenance": {
    "frozenBeforeRun": true,
    "source": "engine/contracts/engineering/catalogs/round-integrity-contract.json"
  }
}
