{
  "schemaVersion": 1,
  "id": "reg-result-transaction-terminal-precedence-explicit",
  "lane": "regression",
  "artifact": {
    "label": "Terminal owner with one-shot latch and explicit deterministic precedence",
    "file": "engine/fixtures/regressions/result-transaction/terminal-precedence-explicit.ts",
    "sha256": "8e5fa8f02d116b3df6b774c40dcba52c089c43d72131fdd021158365266243e7"
  },
  "target": {
    "edition": "bedrock",
    "minecraftVersion": "1.21.x"
  },
  "expected": {
    "disposition": "designed-behavior",
    "domain": "Round Result Transaction Integrity",
    "proofCeiling": "STATIC VERIFIED"
  },
  "provenance": {
    "frozenBeforeRun": true,
    "source": "engine/contracts/engineering/catalogs/round-integrity-contract.json"
  }
}
